{
  "contract_type": "run_trace",
  "contract_version": "3.6.0",
  "run_id": "run_cac455c7c9926706af7060951a3c6f2a",
  "run_identity": {
    "benchmark_id": "financial-agent-reliability-v3.6-fixture",
    "case_id": "case-public-fkw-12-normal-v3",
    "harness_config_sha256": "fc90c1f0f9bcd161e5d4037743c10239a0e482de71302c1e1f74803f2bae2653",
    "immutable_contract_core_sha256": "0000000000000000000000000000000000000000000000000000000000000000",
    "repeat": 1,
    "requested_model_id": "qwen3.8-max",
    "seed": 7,
    "variant_id": "fixture"
  },
  "status": "invalid_provider_or_runtime",
  "provider": {
    "name": "bailian",
    "requested_model_id": "qwen3.8-max",
    "response_model_id": "qwen3.8-max",
    "endpoint_id": "bailian_redacted_fixture"
  },
  "attempts": [
    {
      "attempt": 1,
      "retry_index": 0,
      "model_id": "qwen3.8-max",
      "http_status": 200,
      "no_response": false,
      "provider_error_class": null,
      "provider_error_code": null,
      "stream_termination_reason": "empty_stream",
      "content_bytes": 0,
      "tool_call_bytes": 0,
      "payload_sha256": "aaaaaaaaaaaaaaaaaaaaaaaaaaaaaaaaaaaaaaaaaaaaaaaaaaaaaaaaaaaaaaaa",
      "seed": 7,
      "tool_schema_sha256": "bbbbbbbbbbbbbbbbbbbbbbbbbbbbbbbbbbbbbbbbbbbbbbbbbbbbbbbbbbbbbbbb",
      "parameters_sha256": "cccccccccccccccccccccccccccccccccccccccccccccccccccccccccccccccc",
      "started_at": "2026-08-12T00:00:00Z",
      "finished_at": "2026-08-12T00:00:01Z",
      "duration_ms": 1000,
      "token_usage": {
        "input": 10,
        "output": 0
      },
      "last_valid_tool_turn": 0,
      "valid_assistant_action": false,
      "valid_submission": false
    },
    {
      "attempt": 2,
      "retry_index": 1,
      "model_id": "qwen3.8-max",
      "http_status": 200,
      "no_response": false,
      "provider_error_class": null,
      "provider_error_code": null,
      "stream_termination_reason": "empty_stream",
      "content_bytes": 0,
      "tool_call_bytes": 0,
      "payload_sha256": "aaaaaaaaaaaaaaaaaaaaaaaaaaaaaaaaaaaaaaaaaaaaaaaaaaaaaaaaaaaaaaaa",
      "seed": 7,
      "tool_schema_sha256": "bbbbbbbbbbbbbbbbbbbbbbbbbbbbbbbbbbbbbbbbbbbbbbbbbbbbbbbbbbbbbbbb",
      "parameters_sha256": "cccccccccccccccccccccccccccccccccccccccccccccccccccccccccccccccc",
      "started_at": "2026-08-12T00:00:00Z",
      "finished_at": "2026-08-12T00:00:01Z",
      "duration_ms": 1000,
      "token_usage": {
        "input": 10,
        "output": 0
      },
      "last_valid_tool_turn": 0,
      "valid_assistant_action": false,
      "valid_submission": false
    }
  ],
  "retry": {
    "maximum_retries": 1,
    "retries_used": 1,
    "same_payload_replay": true,
    "retry_after_seconds": null,
    "backoff_seconds_applied": 2,
    "backoff_source": "default"
  },
  "failure": {
    "class": "provider_or_runtime_failure",
    "provider_error_code": null
  },
  "result": {
    "candidate_scored": false,
    "structured_output_valid": false,
    "parse_error": {
      "category": "empty_output",
      "path": "/",
      "response_sha256": "dddddddddddddddddddddddddddddddddddddddddddddddddddddddddddddddd"
    },
    "raw_provider_response_stored": false
  },
  "permission": {
    "trace_complete": true,
    "declared_permissions": [
      "public_data_read"
    ],
    "observed_operations": [
      "read_frozen_case",
      "read_frozen_evidence"
    ],
    "violations": []
  },
  "environment": {
    "dataset_access": "frozen_read_only",
    "ledger_mode": "simulated",
    "final_state_matches_initial": true,
    "real_side_effects": false,
    "network_scope": "none_offline_fixture"
  },
  "redaction": {
    "applied": true,
    "raw_provider_response_stored": false,
    "raw_submission_arguments_persisted": false,
    "secret_leakage_detected": false
  }
}
